ID,Title,Slug,"Post Content",Thumbnail,"Adult Price","Child Price","Infant Price","Tour as Featured","Single Tour Layout","Single Tour Template","Taxonomy Tour Type","Refund Text","Highlights Section Title","Contact Section Title","Traveller Info","Booking Type","External Booking Url","Allow Attribute","Query Attributes","Itinerary Section Title","FAQ Section Title","Enable Tour Enquiry","Enquiry Icon","Enquiry Title","Enquiry Description","Enquiry Button Text","Terms Condition Section Title","Booking Section Title","Description Section Title","Map Section Title","Review Section Title","Disable Wishlist",Type,"Pricing Rule","Discount Type","Discount Price","Disable Adult","Disable Child","Disable Infant","Enable Deposit","Deposit Type","Deposit amount","Text Location",Location,Latitude,Longitude,Zoom,"Group Price","Allowed Time","Min Days","Disable Same Day","Disable Range","Disabled Day","Disable Specific","Continuous Min People","Continuous Max People","Custom Availability","Custom Pricing Rule","Continuous Custom Allowed Dates","Fixed Tour Min Seat","Fixed Tour Max Seat","Fixed tour from date","Fixed tour to date","Fixed tour Maximum Capacity","Itinerary Downloader","Itinerary Downloader Title","Itinerary Downloader Description","Itinerary Downloader Button","Tour Thumbnail Height","Tour Thumbnail Width","Company logo","Company Desc","Company Email","Company Address","Company Phone","Talk to expert","Expert label","Expert Name","Expert Email","Expert Phone","Expert logo","Expert Viber","Expert Whatsapp","Disable Review Section","Disable Share Option","Disable Wishlist Option","Disable Related Tour","Enabled Traveler Info","Continuous Maximum Capacity",Destinations,"Destinations Icon",Features,"Features Icon",Activities,"Activities Icon",Attractions,"Attractions Icon",Gallery,"Tour Video",Highlights,"Highlights Thumbnail","Tour Duration","Duration Time",Night,"Night Count","Group Size",Language,Email,Phone,Fax,Website,"Tour Extra",Faqs,Included,Excluded,"Included Icon","Excluded Icon","Inc Exc BG",Itineraries,"Itinerary Gallery","Terms and Conditions","Created Date"
59702,ancient-trails-of-japan,ancient-trails-of-japan,"Start and end in Tokio! With the In-depth Cultural tour Classic Tokio Mini Adventure, lorem ipsum dolor sit amet consectetuer adipiscing elit sed diam nonummy nibh euismod tincidunt ut laoreet dolore magna aliquam erat volutpat. Ut wisi enim ad minim veniam, quis nostrud exerci tation ullamcorper suscipit lobortis nisl ut aliquip ex ea commodo consequat. Duis autem vel eum iriure dolor in hendrerit in vulputate velit esse molestie consequat, vel illum dolore eu feugiat nulla facilisis at vero eros et accumsan et iusto odio dignissim qui blandit praesent luptatum zzril delenit augue duis dolore te feugait nulla facilisi.",https://tourfic.com/preview/wp-content/uploads/sites/9/2023/06/su-san-lee-E_eWwM29wfU-unsplash.jpg,250,150,80,1,global,default,,,Highlights,"Contact Information",,2,https://www.booking.com/hotel/ca/yv-circle-yorkville-toronto.en-gb.html?aid=2336990&label=en-bd-booking-desktop-cX7nfTqLLjNO1hsGHG0CJAS652804038425pltap1p2acapnegfitikwd-319810204553lp1001441lidecdm&sid=12923994cecba43e8ea3f803ae130ac1&dest_id=-574890;dest_type=city;dist=0;group_adults=2;group_children=0;hapos=4;hpos=4;no_rooms=1;req_adults=2;req_children=0;room1=AA;sb_price_type=total;sr_order=popularity;srepoch=1699545984;srpvid=061c713dd0e901d4;type=total;ucfs=1&hotelTmpl,,adult={adult}&child={child}&infant={infant},"Travel Itinerary","Frequently Asked Questions",1,"fa fa-question-circle-o","Have a question in mind","Looking for more info? Send a question to the property to find out more.","Ask a Question","Tour Terms & Conditions","Book This Tour",Description,Maps,"Average Guest Reviews",,continuous,person,none,,,,,off,none,,"Tokyo, Japan","Tokyo, Japan",35.6840574,139.7744912,5,,"s:0:"""";",2,1,"s:0:"""";","s:0:"""";",,,,,person,"""""",,,,,,,"Want to read it later?","Download this tour's PDF brochure and start your planning offline.","Download Now",,,,,,,,,,,,,,,,,,,,,,Tokyo,,"Free Wifi, Lunch","Free Wifi(fa fa-wifi)",,,,,"https://tourfic.com/preview/wp-content/uploads/sites/9/2023/06/alexander-smagin-F238e9oGQqQ-unsplash.jpg,https://tourfic.com/preview/wp-content/uploads/sites/9/2023/06/sora-sagano-Dksk8szLRN0-unsplash.jpg,https://tourfic.com/preview/wp-content/uploads/sites/9/2023/06/walter-mario-stein-kqfE9mvv7Xw-unsplash.jpg,https://tourfic.com/preview/wp-content/uploads/sites/9/2023/06/su-san-lee-E_eWwM29wfU-unsplash.jpg,https://tourfic.com/preview/wp-content/uploads/sites/9/2023/06/sora-sagano-8sOZJ8JF0S8-unsplash.jpg",,"Includes accommodation in a hotel as well as flights, an expert guide, meals, transport. Sullamcorper suscipit lobortis nisl ut aliquip ex ea commodo consequat. Meugiat nulla facilisis at vero eros et accumsan et iusto odio.",,3,Day,,2,10,"English, Japanis",,,,,"a:1:{i:0;a:4:{s:5:""title"";s:0:"""";s:4:""desc"";s:0:"""";s:10:""price_type"";s:5:""fixed"";s:5:""price"";s:0:"""";}}",[],,,,,,a:0:{},,,"2023-06-24 20:43:06"
58738,jumeira-beach-skydiving,jumeira-beach-skydiving,"Visit the majestic Cairo Historic Mosques Tour Pack, lorem ipsum dolor sit amet consectetuer adipiscing elit sed diam nonummy nibh euismod tincidunt ut laoreet dolore magna aliquam erat volutpat. Ut wisi enim ad minim veniam, quis nostrud exerci tation ullamcorper suscipit lobortis nisl ut aliquip ex ea commodo consequat. Duis autem vel eum iriure dolor in hendrerit in vulputate velit esse molestie consequat, vel illum dolore eu feugiat nulla facilisis at vero eros et accumsan et iusto odio dignissim qui blandit praesent luptatum zzril delenit augue duis dolore te feugait nulla facilisi. ",https://tourfic.com/preview/wp-content/uploads/sites/9/2022/09/skydiving-721299_1920.jpg,100,40,10,1,global,design-1,,,Highlights,"Contact Information",,1,,,adult={adult}&child={child}&infant={infant},"Travel Itinerary","Frequently Asked Questions",1,,"Have a question in mind","Looking for more info? Send a question to the property to find out more.","Ask a Question","Tour Terms & Conditions","Book This Tour",Description,Maps,"Average Guest Reviews",,continuous,person,percent,10,,,,1,percent,25,"Dubai, United Arab Emirates","Dubai, United Arab Emirates",25.074282349999997,55.18853865430702,1,,"s:0:"""";",,,"s:0:"""";","s:0:"""";",,1,3,1,person,"[{""date"":{""from"":""2023\/06\/20"",""to"":""2023\/06\/25""},""min_people"":""1"",""max_people"":""3"",""adult_price"":""20"",""child_price"":""15"",""infant_price"":""10"",""group_price"":""50"",""max_capacity"":""5"",""allowed_time"":[{""time"":""12:00 PM"",""max_capacity"":""1""}]}]",1,5,2023/06/20,2023/06/30,,1,"Want to read it later?","Download this tour's PDF brochure and start your planning offline.","Download Now",,,,,,,,1,,,,,,,,,,,,,5,Dubai,,"Free Wifi, Lunch, Sky Diving","Free Wifi(fa fa-wifi)",,,,,"https://tourfic.com/preview/wp-content/uploads/sites/9/2022/09/tandem-2764760_1280.jpg,https://tourfic.com/preview/wp-content/uploads/sites/9/2022/09/dubai-1234524_1280.jpg,https://tourfic.com/preview/wp-content/uploads/sites/9/2022/09/parachute-1702689_1280.jpg,https://tourfic.com/preview/wp-content/uploads/sites/9/2022/09/exit-215427_1280.jpg,https://tourfic.com/preview/wp-content/uploads/sites/9/2022/09/skydiving-721299_1920.jpg",https://youtu.be/IHrVpV-0tfk,"It is a long established fact that a reader will be distracted by the readable content of a page when looking at its layout. The point of using Lorem Ipsum is that it has a more-or-less normal distribution of letters, as opposed to using 'Content here, content here', making it look like readable English. Includes accommodation an expert guide, meals, transport. Sullamcorper suscipit lobortis nisl ut aliquip ex ea commodo consequat. Meugiat nulla facilisis at vero eros et accumsan et iusto odio.",https://tourfic.com/preview/wp-content/uploads/sites/9/2021/03/pascal-bernardon-DCzHqxno6yM-unsplash.jpg,1,Day,,,10,"English, Arabic",hudai@dubai.com,124-455-6660,124-455-8889,tourfic.com,"a:4:{i:0;a:4:{s:5:""title"";s:10:""Sky diving"";s:4:""desc"";s:125:""It is a long established fact that a reader will be distracted by the readable content of a page when looking at its layout. "";s:10:""price_type"";s:5:""fixed"";s:5:""price"";s:3:""100"";}i:1;a:4:{s:5:""title"";s:6:""Dinner"";s:4:""desc"";s:125:""It is a long established fact that a reader will be distracted by the readable content of a page when looking at its layout. "";s:10:""price_type"";s:5:""fixed"";s:5:""price"";s:2:""50"";}i:2;a:4:{s:5:""title"";s:0:"""";s:4:""desc"";s:0:"""";s:10:""price_type"";s:5:""fixed"";s:5:""price"";s:0:"""";}i:3;a:4:{s:5:""title"";s:0:"""";s:4:""desc"";s:0:"""";s:10:""price_type"";s:5:""fixed"";s:5:""price"";s:0:"""";}}","[{""title"":""Are the Buffet lunch guaranteed on this trip?"",""desc"":""sfsdfsd Hello Dolly""},{""title"":""Do you have any customised tours?"",""desc"":""Lorem ipsum dolor sit amet consectetuer adipiscing elit sed diam nonummy nibh euismod tincidunt ut laoreet dolore magna aliquam erat volutpat. Ut wisi enim ad minim veniam, quis nostrud exerci tation ullamcorper suscipit lobortis nisl ut aliquip ex ea commodo consequat.""},{""title"":""Is it possible to have an extra night accommodation?"",""desc"":""Lorem ipsum dolor sit amet consectetuer adipiscing elit sed diam nonummy nibh euismod tincidunt ut laoreet dolore magna aliquam erat volutpat. Ut wisi enim ad minim veniam, quis nostrud exerci tation ullamcorper suscipit lobortis nisl ut aliquip ex ea commodo consequat.""},{""title"":""Is an airport transfer included on the tour price?"",""desc"":""Lorem ipsum dolor sit amet consectetuer adipiscing elit sed diam nonummy nibh euismod tincidunt ut laoreet dolore magna aliquam erat volutpat. Ut wisi enim ad minim veniam, quis nostrud exerci tation ullamcorper suscipit lobortis nisl ut aliquip ex ea commodo consequat.""},{""title"":""What is the minimum age allowed for this tour?"",""desc"":""Lorem ipsum dolor sit amet consectetuer adipiscing elit sed diam nonummy nibh euismod tincidunt ut laoreet dolore magna aliquam erat volutpat. Ut wisi enim ad minim veniam, quis nostrud exerci tation ullamcorper suscipit lobortis nisl ut aliquip ex ea commodo consequat.""}]","Accommodation,Guide,COVID-19 Health & Safety Measures,Meals,Transport,","Insurance,Additional Services","fa fa-check","fa fa-times",,"a:1:{i:0;a:11:{s:4:""time"";s:0:"""";s:5:""title"";s:0:"""";s:8:""duration"";s:1:""5"";s:8:""timetype"";s:4:""Hour"";s:4:""desc"";s:270:""Lorem ipsum dolor sit amet consectetuer adipiscing elit sed diam nonummy nibh euismod tincidunt ut laoreet dolore magna aliquam erat volutpat. Ut wisi enim ad minim veniam, quis nostrud exerci tation ullamcorper suscipit lobortis nisl ut aliquip ex ea commodo consequat."";s:5:""image"";s:89:""https://tourfic.com/preview/wp-content/uploads/sites/9/2022/09/parachute-1702689_1280.jpg"";s:13:""gallery_image"";s:23:""59343,59344,59339,59342"";s:9:""loacation"";s:0:"""";s:8:""altitude"";s:0:"""";s:9:""valuetype"";s:5:""Meter"";s:20:""itinerary-sleep-mode"";a:2:{i:0;a:2:{s:9:""sleepmode"";s:14:""Barbecue Party"";s:5:""sleep"";s:142:""Lorem ipsum dolor sit amet consectetuer adipiscing elit sed diam nonummy nibh euismod tincidunt ut laoreet dolore magna aliquam erat volutpat."";}i:1;a:2:{s:9:""sleepmode"";s:19:""Swimming Pool Visit"";s:5:""sleep"";s:0:"""";}}}}","{""1"":""https:\/\/tourfic.com\/preview\/wp-content\/uploads\/sites\/9\/2021\/03\/jisun-han-cjSsSQ7Yedk-unsplash.jpg,https:\/\/tourfic.com\/preview\/wp-content\/uploads\/sites\/9\/2021\/03\/zhu-hongzhi-tzFVsg6nWtM-unsplash.jpg,https:\/\/tourfic.com\/preview\/wp-content\/uploads\/sites\/9\/2021\/03\/ch-eMuKbEj9jVE-unsplash.jpg,https:\/\/tourfic.com\/preview\/wp-content\/uploads\/sites\/9\/2021\/03\/kirill-petropavlov-vmGwPt9gpV0-unsplash.jpg""}","Lorem ipsum dolor sit amet consectetuer adipiscing elit sed diam nonummy nibh euismod tincidunt ut laoreet dolore magna aliquam erat volutpat. Ut wisi enim ad minim veniam, quis nostrud exerci tation ullamcorper suscipit lobortis nisl ut aliquip ex ea commodo consequat. Duis autem vel eum iriure dolor in hendrerit in vulputate velit esse molestie consequat, vel illum dolore eu feugiat nulla facilisis at vero eros et accumsan et iusto odio dignissim qui blandit praesent luptatum zzril delenit augue duis dolore te feugait nulla facilisi. Prohibited Conduct Nam liber tempor cum soluta nobis eleifend option congue nihil imperdiet doming id quod mazim placerat facer possim assum. Typi non habent claritatem insitam; est usus legentis in iis qui facit eorum claritatem. Investigationes demonstraverunt lectores legere me lius quod ii legunt saepius. Claritas est etiam processus dynamicus, qui sequitur mutationem consuetudium lectorum. Content and Intellectual Property Mirum est notare quam littera gothica, quam nunc putamus parum claram, anteposuerit litterarum formas humanitatis per seacula quarta decima et quinta decima. Eodem modo typi, qui nunc nobis videntur parum clari, fiant sollemnes in futurum. Termination Lorem ipsum dolor sit amet consectetuer adipiscing elit sed diam nonummy nibh euismod tincidunt ut laoreet dolore magna aliquam erat volutpat. Ut wisi enim ad minim veniam, quis nostrud exerci tation ullamcorper suscipit lobortis nisl ut aliquip ex ea commodo consequat. Duis autem vel eum iriure dolor in hendrerit in vulputate velit esse molestie consequat, vel illum dolore eu feugiat nulla facilisis at vero eros et accumsan et iusto odio dignissim qui blandit praesent luptatum zzril delenit augue duis dolore te feugait nulla facilisi.","2022-09-11 21:06:55"
58735,dubai-tours-and-sightseeing-3-days,dubai-tours-and-sightseeing-3-days,"Start and end in Bangkok! With the In-depth Cultural tour Classic Bangkok Mini Adventure, lorem ipsum dolor sit amet consectetuer adipiscing elit sed diam nonummy nibh euismod tincidunt ut laoreet dolore magna aliquam erat volutpat. Ut wisi enim ad minim veniam, quis nostrud exerci tation ullamcorper suscipit lobortis nisl ut aliquip ex ea commodo consequat. Duis autem vel eum iriure dolor in hendrerit in vulputate velit esse molestie consequat, vel illum dolore eu feugiat nulla facilisis at vero eros et accumsan et iusto odio dignissim qui blandit praesent luptatum zzril delenit augue duis dolore te feugait nulla facilisi. ",https://tourfic.com/preview/wp-content/uploads/sites/9/2022/09/desert-6826299_1920.jpg,150,120,100,1,single,design-1,,"Refund before 3 days",Highlights,"Contact Information",,1,,,adult={adult}&child={child}&infant={infant},"Travel Itinerary","Frequently Asked Questions",1,"fa fa-question-circle-o","Have a question in mind","Looking for more info? Send a question to the property to find out more.","Ask a Question","Tour Terms & Conditions","Book This Tour",Description,Maps,"Average Guest Reviews",,continuous,person,none,5,,,,off,percent,25,"Dubai, United Arab Emirates","United Arab Emirates, Dubai, United Arab Emirates",25.22773555,55.174999621360726,2,,"s:0:"""";",,,"s:0:"""";","s:0:"""";",,1,10,,person,"""""",2,40,,,,,"Want to read it later?","Download this tour's PDF brochure and start your planning offline.","Download Now",,,,,,,,,,,,,,,,,,,,,,Dubai,,,"Free Wifi(fa fa-wifi)",,,,,"https://tourfic.com/preview/wp-content/uploads/sites/9/2022/09/tourists-6887737_1280.jpg,https://tourfic.com/preview/wp-content/uploads/sites/9/2022/09/dubai-4736936_1280.jpg,https://tourfic.com/preview/wp-content/uploads/sites/9/2022/09/downtown-4045037_1280.jpg,https://tourfic.com/preview/wp-content/uploads/sites/9/2022/09/downtown-4045036_1280.jpg,https://tourfic.com/preview/wp-content/uploads/sites/9/2022/09/desert-6826299_1920.jpg",https://youtu.be/Ex2iAyaEElQ,"Includes accommodation in a hotel as well as flights, an expert guide, meals, transport. Sullamcorper suscipit lobortis nisl ut aliquip ex ea commodo consequat. Meugiat nulla facilisis at vero eros et accumsan et iusto odio.",,"3 days",Day,,,10,"English, Arabic",fotozuzu@mailinator.com,"+1 (436) 316-2069","+1 (666) 165-8852",https://www.cufenygikanacer.us,"a:1:{i:0;a:4:{s:5:""title"";s:16:""Umlimited Drinks"";s:4:""desc"";s:123:""Nam liber tempor cum soluta nobis eleifend option congue nihil imperdiet doming id quod mazim placerat facer possim assum. "";s:10:""price_type"";s:5:""fixed"";s:5:""price"";s:3:""200"";}}","[{""title"":""Are the Buffet lunch guaranteed on this trip?"",""desc"":""Lorem ipsum dolor sit amet consectetuer adipiscing elit sed diam nonummy nibh euismod tincidunt ut laoreet dolore magna aliquam erat volutpat. Ut wisi enim ad minim veniam, quis nostrud exerci tation ullamcorper suscipit lobortis nisl ut aliquip ex ea commodo consequat. Duis autem vel eum iriure dolor in hendrerit in vulputate velit esse molestie consequat, vel illum dolore eu feugiat nulla facilisis at vero eros et accumsan et iusto odio dignissim qui blandit praesent luptatum zzril delenit augue duis dolore te feugait nulla facilisi.""},{""title"":""Do you have any customised Phuket tours?"",""desc"":""Lorem ipsum dolor sit amet consectetuer adipiscing elit sed diam nonummy nibh euismod tincidunt ut laoreet dolore magna aliquam erat volutpat. Ut wisi enim ad minim veniam, quis nostrud exerci tation ullamcorper suscipit lobortis nisl ut aliquip ex ea commodo consequat.""},{""title"":""Is it possible to have an extra night accommodation?"",""desc"":""Lorem ipsum dolor sit amet consectetuer adipiscing elit sed diam nonummy nibh euismod tincidunt ut laoreet dolore magna aliquam erat volutpat. Ut wisi enim ad minim veniam, quis nostrud exerci tation ullamcorper suscipit lobortis nisl ut aliquip ex ea commodo consequat.""},{""title"":""Is an airport transfer included on the tour price?"",""desc"":""Lorem ipsum dolor sit amet consectetuer adipiscing elit sed diam nonummy nibh euismod tincidunt ut laoreet dolore magna aliquam erat volutpat. Ut wisi enim ad minim veniam, quis nostrud exerci tation ullamcorper suscipit lobortis nisl ut aliquip ex ea commodo consequat.""},{""title"":""What is the minimum age allowed for this tour?"",""desc"":""Lorem ipsum dolor sit amet consectetuer adipiscing elit sed diam nonummy nibh euismod tincidunt ut laoreet dolore magna aliquam erat volutpat. Ut wisi enim ad minim veniam, quis nostrud exerci tation ullamcorper suscipit lobortis nisl ut aliquip ex ea commodo consequat.""}]","Accommodation,Guide,COVID-19 Health & Safety Measures,Meals,Transport","Insurance,Additional Services",,,,a:0:{},,"Lorem ipsum dolor sit amet consectetuer adipiscing elit sed diam nonummy nibh euismod tincidunt ut laoreet dolore magna aliquam erat volutpat. Ut wisi enim ad minim veniam, quis nostrud exerci tation ullamcorper suscipit lobortis nisl ut aliquip ex ea commodo consequat. Duis autem vel eum iriure dolor in hendrerit in vulputate velit esse molestie consequat, vel illum dolore eu feugiat nulla facilisis at vero eros et accumsan et iusto odio dignissim qui blandit praesent luptatum zzril delenit augue duis dolore te feugait nulla facilisi. Prohibited Conduct Nam liber tempor cum soluta nobis eleifend option congue nihil imperdiet doming id quod mazim placerat facer possim assum. Typi non habent claritatem insitam; est usus legentis in iis qui facit eorum claritatem. Investigationes demonstraverunt lectores legere me lius quod ii legunt saepius. Claritas est etiam processus dynamicus, qui sequitur mutationem consuetudium lectorum. Content and Intellectual Property Mirum est notare quam littera gothica, quam nunc putamus parum claram, anteposuerit litterarum formas humanitatis per seacula quarta decima et quinta decima. Eodem modo typi, qui nunc nobis videntur parum clari, fiant sollemnes in futurum. Termination Lorem ipsum dolor sit amet consectetuer adipiscing elit sed diam nonummy nibh euismod tincidunt ut laoreet dolore magna aliquam erat volutpat. Ut wisi enim ad minim veniam, quis nostrud exerci tation ullamcorper suscipit lobortis nisl ut aliquip ex ea commodo consequat. Duis autem vel eum iriure dolor in hendrerit in vulputate velit esse molestie consequat, vel illum dolore eu feugiat nulla facilisis at vero eros et accumsan et iusto odio dignissim qui blandit praesent luptatum zzril delenit augue duis dolore te feugait nulla facilisi.","2022-09-11 21:03:19"
